<?xml version="1.0" encoding="UTF-8"?>
<!DOCTYPE table SYSTEM "http://web.magti.ge/pda/defines/xml/component.config.dtd">
<config>
    <defaultTask value="add" />
    <tasks>
        <task name="add" default="1" label="add" />
        <task name="edit" default="1" label="edit" />
        <task name="approve" default="1" label="approve" />
        <task name="approvedone" default="1" label="approvedone" />
        <task name="delete" default="1" label="delete" />
    </tasks>
    <allowTasks>
        <task name="next" default="1" label="next" />
        <task name="cancel" default="1" label="cancel" />
        <task name="save" default="1" label="save" />
    </allowTasks>
</config>